{
  "schemaVersion": 1,
  "id": "io.github.glynch.runtime-test",
  "version": "1.0.0",
  "engineRequires": ">=0.1.0-SNAPSHOT <0.2.0",
  "displayName": "Runtime Test",
  "components": [
    {
      "id": "io.github.glynch.runtime-test/blink",
      "typeVersion": 1,
      "displayName": "Blink",
      "updatePhases": ["frame-update"]
    }
  ],
  "types": [
    {
      "id": "io.github.glynch.runtime-test/group-3d",
      "typeVersion": 1,
      "scope": "scene-node",
      "displayName": "Group 3d",
      "properties": [
        {
          "id": "label",
          "valueKind": "text",
          "defaultValue": "Default root",
          "displayName": "Label"
        }
      ]
    },
    {
      "id": "io.github.glynch.runtime-test/timer",
      "typeVersion": 1,
      "scope": "scene-node",
      "displayName": "Timer",
      "properties": [
        {
          "id": "phase",
          "valueKind": "text",
          "defaultValue": "before-physics",
          "displayName": "Phase"
        }
      ],
      "signals": [
        {
          "id": "timeout",
          "displayName": "Timeout"
        }
      ]
    },
    {
      "id": "io.github.glynch.runtime-test/indicator-3d",
      "typeVersion": 1,
      "scope": "scene-node",
      "displayName": "Indicator 3d",
      "properties": [
        {
          "id": "active",
          "valueKind": "boolean",
          "defaultValue": false,
          "displayName": "Active"
        }
      ]
    },
    {
      "id": "io.github.glynch.runtime-test/toggle-controller",
      "typeVersion": 1,
      "scope": "node-controller",
      "displayName": "Toggle Controller",
      "actions": [
        {
          "id": "toggle",
          "displayName": "Toggle"
        }
      ]
    },
    {
      "id": "io.github.glynch.runtime-test/resource-consumer-3d",
      "typeVersion": 1,
      "scope": "scene-node",
      "displayName": "Resource Consumer 3d",
      "properties": [
        {
          "id": "resource",
          "valueKind": "reference",
          "required": true,
          "displayName": "Resource",
          "acceptedReferences": ["project", "import"]
        }
      ]
    },
    {
      "id": "io.github.glynch.runtime-test/shared-data",
      "typeVersion": 1,
      "scope": "resource",
      "displayName": "Shared Data",
      "properties": [
        {
          "id": "label",
          "valueKind": "text",
          "defaultValue": "Default data",
          "displayName": "Label"
        },
        {
          "id": "dependency",
          "valueKind": "reference",
          "displayName": "Dependency",
          "acceptedReferences": ["project"]
        }
      ]
    },
    {
      "id": "io.github.glynch.runtime-test/unbound-data",
      "typeVersion": 1,
      "scope": "resource",
      "displayName": "Unbound Data",
      "properties": [
        {
          "id": "label",
          "valueKind": "text",
          "displayName": "Label"
        }
      ]
    },
    {
      "id": "io.github.glynch.runtime-test/text-data",
      "typeVersion": 1,
      "scope": "resource",
      "displayName": "Text Data",
      "properties": [
        {
          "id": "label",
          "valueKind": "text",
          "defaultValue": "Default text",
          "displayName": "Label"
        }
      ]
    }
  ]
}
