{
  "schemaVersion": 1,
  "id": "io.github.glynch.jscene3d.gltf",
  "version": "0.1.0-SNAPSHOT",
  "engineRequires": ">=0.1.0-SNAPSHOT <0.2.0",
  "displayName": "JScene3D glTF Import",
  "types": [
    {
      "id": "io.github.glynch.jscene3d.gltf/scene",
      "typeVersion": 1,
      "scope": "importer",
      "displayName": "glTF Scene"
    }
  ]
}
